{"$schema":"../wake-observation.schema.json","schemaVersion":1,"observationDate":"2026-08-27","article":{"slug":"morning-soundings-2026-08-27","title":"Morning Soundings: The Weather Inside a Glass of Water","publishedAt":"2026-08-27T05:00:00-07:00","path":"src/content/soundings/morning-soundings-2026-08-27.md"},"capture":{"mode":"reconstructed","capturedAt":"2026-08-30T15:42:25-07:00","sourceStateAsOf":"2026-08-27","notes":"Reconstructed on August 30, 2026 from the published Morning Soundings article and the sources it cited. This packet was not emitted by the original daily run."},"signals":[{"signalId":"2026-08-27-amphibian-rpg-no-money","order":1,"sectionRole":"signal","headline":"A frog RPG has abolished money","canonicalSubject":{"name":"Amphibian","kind":"video-game","aliases":["Amphibian RPG","JARCORP Amphibian"]},"signalType":"design-announcement","topics":["jrpgs","video-games","game-design","resource-scarcity"],"geography":["Global"],"canonicalClaim":"The announced RPG Amphibian said it would omit shops, buying, selling, random encounters, and level grinding while using placed battles, dwindling supplies, and persistent injuries.","knownFacts":["The official site advertised no conventional economy or grinding.","The game targeted 2028, while its Steam page did not yet give a firm date.","Planned platforms included PlayStation 5, Xbox Series, Switch, and PC."],"uncertainties":["An unreleased design promise cannot show whether scarcity will create drama, frustration, or exploitable recovery loops."],"evidence":{"level":"mixed","notes":"The design promises are first-party; specialist reporting corroborated the announcement and platforms but not the future play experience."},"sources":[{"url":"https://amphibiangame.com/","title":"Amphibian official site","publisher":"JARCORP Interactive","publishedAt":null,"accessedAt":"2026-08-27","role":"first-party","lineage":"amphibian-announcement"},{"url":"https://www.gematsu.com/2026/08/super2d-turn-based-rpg-amphibian-announced-for-ps5-xbox-series-switch-and-pc","title":"Amphibian announced for consoles and PC","publisher":"Gematsu","publishedAt":null,"accessedAt":"2026-08-27","role":"independent-reporting","lineage":"amphibian-announcement"}],"openQuestions":["Will the finished game truly prevent time and currency from manufacturing safety?","How will players recover from injuries or resource mistakes?","Will it ship in 2028?"],"watchFor":[{"description":"Detailed systems demonstration or playable demo","expectedWindow":"Before 2028","trigger":"Players can inspect economy, recovery, encounter, and injury systems."},{"description":"Release and independent systems analysis","expectedWindow":"During or after 2028","trigger":"The finished game can be compared with the no-money and no-grinding promises."}],"trackingTerms":["Amphibian RPG","Amphibian no shops","Amphibian no grinding","JARCORP Amphibian release"],"existingWakeId":null,"disposition":{"status":"active-candidate","reason":"The game makes unusually specific, falsifiable systems promises with a future release."},"selectionReason":"Its mechanics attempted to carry drought and deprivation across the boundary between story and system.","reviewAfter":"2027-02-01","attentionSnapshot":null},{"signalId":"2026-08-27-starling-falcon-navigation","order":2,"sectionRole":"signal","headline":"Satellites learned to use the traffic as a map","canonicalSubject":{"name":"Starling FALCON navigation experiment","kind":"space-mission","aliases":["FALCON optical navigation","NASA Starling GPS-independent navigation"]},"signalType":"mission-result","topics":["space","satellites","navigation","orbital-debris"],"geography":["Low Earth orbit","United States"],"canonicalClaim":"NASA reported that Starling’s FALCON system used cataloged spacecraft and debris observed by star trackers to estimate orbits without GPS and improve estimates for more than 200 catalog objects.","knownFacts":["The three-day experiment used a catalog of roughly 20,000 objects.","NASA said onboard estimates for more than 200 objects were more precise than the supplied ground catalog.","A later four-spacecraft collaborative experiment was expected in 2026."],"uncertainties":["The report was NASA’s account of its own mission, and independent performance analysis was not cited.","Performance across other orbital regimes and operational conditions remained unknown."],"evidence":{"level":"primary-supported","notes":"An official mission report describes completed tests and a named forthcoming experiment."},"sources":[{"url":"https://www.nasa.gov/blogs/smallsatellites/2026/08/17/nasas-starling-mission-opens-new-frontiers-in-space-navigation/","title":"NASA Starling mission opens new frontiers in space navigation","publisher":"NASA","publishedAt":"2026-08-17","accessedAt":"2026-08-27","role":"official-primary","lineage":"nasa-starling-falcon-results"}],"openQuestions":["Did the four Starling spacecraft complete collective navigation and mapping successfully?","How do the autonomous estimates compare with operational tracking systems over longer periods?"],"watchFor":[{"description":"Collaborative four-spacecraft FALCON results","expectedWindow":"Later in 2026","trigger":"NASA publishes results from shared observations among the Starling spacecraft."},{"description":"Adoption or replication on another mission","expectedWindow":"Unknown","trigger":"Another spacecraft program tests catalog-based optical navigation operationally."}],"trackingTerms":["NASA Starling FALCON","FALCON optical navigation","Starling GPS independent navigation","orbital debris navigation landmarks"],"existingWakeId":null,"disposition":{"status":"active-candidate","reason":"A completed baseline experiment is followed by a concrete near-term collaborative test."},"selectionReason":"The experiment inverted orbital clutter from a navigation hazard into a set of usable landmarks and a collectively improvable map.","reviewAfter":"2026-11-01","attentionSnapshot":null},{"signalId":"2026-08-27-sardis-monumental-statue","order":3,"sectionRole":"signal","headline":"Sardis paved a road with its own monument","canonicalSubject":{"name":"Monumental archaizing statue from Sardis","kind":"archaeological-object","aliases":["Sardis mystery statue","Sardis Cybele statue"]},"signalType":"archaeological-discovery","topics":["archaeology","ancient-art","sardis","achaemenid-empire"],"geography":["Türkiye","Sardis"],"canonicalClaim":"Archaeologists recovered a monumental marble statue at Sardis whose style may combine older Lydian traditions with fifth-century-BCE anatomy, after the broken object was later reused face-down as Roman paving.","knownFacts":["The reconstructed statue would have stood more than seven feet tall.","The anatomy suggested a date around the 470s–450s BCE while pose, hair, and clothing recalled sixth-century traditions.","Its reuse as paving preserved the front surface."],"uncertainties":["The figure’s identity, original location, possible connection to Cybele, precise date, and surviving paint remained under study."],"evidence":{"level":"preliminary","notes":"The institutional excavation account clearly separated observed material facts from proposed identification and chronology."},"sources":[{"url":"https://news.harvard.edu/gazette/story/2026/08/mystery-statue-unearthed-at-sardis-archaeological-dig/","title":"Mystery statue unearthed at Sardis","publisher":"Harvard Gazette","publishedAt":null,"accessedAt":"2026-08-27","role":"institutional-reporting","lineage":"sardis-excavation-statue-report"}],"openQuestions":["Who or what did the statue represent?","Was it associated with the sanctuary of Cybele?","What will pigment, stone, and contextual analysis add to its chronology and provenance?"],"watchFor":[{"description":"Conservation or scientific-analysis results","expectedWindow":"Unknown","trigger":"The expedition publishes pigment, material, dating, or reconstruction findings."},{"description":"Peer-reviewed identification or contextual interpretation","expectedWindow":"Unknown","trigger":"A formal publication revises or substantiates the Cybele and archaizing-style hypotheses."}],"trackingTerms":["Sardis mystery statue","Sardis Cybele statue","Sardis monumental marble statue","Sardis Roman avenue paving statue"],"existingWakeId":null,"disposition":{"status":"active-candidate","reason":"The named object is under active conservation and several central interpretations remain testable."},"selectionReason":"The object preserved two histories at once: the society that monumentalized it and the later city that treated it as paving stone.","reviewAfter":"2027-02-01","attentionSnapshot":null},{"signalId":"2026-08-27-tempest-turbulence-center","order":4,"sectionRole":"deep-sounding","headline":"Deep sounding: the weather inside a glass of water","canonicalSubject":{"name":"TEMPEST Science and Technology Center","kind":"research-program","aliases":["TEMPEST turbulence center","NSF TEMPEST","Michigan State turbulence center"]},"signalType":"research-program-launch","topics":["physics","turbulence","fusion","artificial-intelligence","fluid-dynamics"],"geography":["United States"],"canonicalClaim":"The National Science Foundation launched the Michigan State–led TEMPEST center with up to $30 million over five years to improve prediction and control of turbulent systems using experiments, mathematics, computing, and AI.","knownFacts":["TEMPEST was one of three new NSF Science and Technology Centers announced in August 2026.","Its stated applications included fusion energy and national-security problems.","The program emphasized trustworthy predictive models rather than AI alone."],"uncertainties":["A funding announcement did not establish future scientific breakthroughs, control performance, or the reliability of learned models outside training regimes."],"evidence":{"level":"primary-supported","notes":"NSF and the lead university established the program, funding horizon, and declared research goals."},"so